{
  "schema_version": "1.0.0",
  "enabled": false,
  "advisory_only": true,
  "model": "jev-1.13.0",
  "portable_context_limit_tokens": 32000,
  "paid_budget_usd": 0.0,
  "allow_paid_fallback": false,
  "production": "NO_GO",
  "allowed_risk_classes": ["R0", "R1"],
  "forbidden_authorities": ["PRODUCTION", "DESTRUCTIVE", "PAYMENT", "SECURITY_OVERRIDE", "PROJECT_COMPLETION", "PROTECTED_LINEAGE"],
  "confidence_threshold": 0.6,
  "routes": [{
    "route_id": "vercel_jev_promotional",
    "cost_class": "PROMOTIONAL_FREE",
    "not_after": "2026-09-25T23:59:59Z",
    "price_observed_at": "2026-09-23T00:00:00Z",
    "zero_price_observed": false
  }]
}
